name||Bronze
nicknames||N/A
source||Alloy of copper and tin
appearance||Looks like bronze
usages||Senses Allomantic pulses (allomancy)
description||In allomancy, bronze is an internal, mental, pushing metal. Burning bronze allows the user to detect people that are using allomancy by sensing the Allomantic pulses that are given off by burning any metal. These pulses are only audible to someone burning bronze. The pairing for bronze is copper.
book source||The Final Empire, Chapter 7; The Final Empire, Ars Arcanum; The Final Empire, Allomancy Alphabetical Reference